{
  "$schema": "https://json-schema.org/draft/2020-12/schema",
  "$id": "https://tplaiter.dev/schema/modifier.v1.schema.json",
  "title": "Modifier v1",
  "type": "object",
  "properties": {
    "apiVersion": {
      "const": "tplaiter.dev/modifier/v1"
    },
    "kind": {
      "const": "Modifier"
    },
    "metadata": {
      "type": "object",
      "properties": {
        "id": {
          "type": "string",
          "pattern": "^[A-Za-z][A-Za-z0-9_.-]{0,127}$"
        },
        "version": {
          "type": "string",
          "pattern": "^(0|[1-9][0-9]*)\\.(0|[1-9][0-9]*)\\.(0|[1-9][0-9]*)(-((0|[1-9][0-9]*|[0-9]*[A-Za-z-][0-9A-Za-z-]*)(\\.(0|[1-9][0-9]*|[0-9]*[A-Za-z-][0-9A-Za-z-]*))*))?(\\+[0-9A-Za-z-]+(\\.[0-9A-Za-z-]+)*)?$"
        }
      },
      "required": [
        "id",
        "version"
      ],
      "additionalProperties": false
    },
    "compatibility": {
      "type": "object",
      "properties": {
        "minimumCLI": {
          "type": "string",
          "pattern": "^(0|[1-9][0-9]*)\\.(0|[1-9][0-9]*)\\.(0|[1-9][0-9]*)(-((0|[1-9][0-9]*|[0-9]*[A-Za-z-][0-9A-Za-z-]*)(\\.(0|[1-9][0-9]*|[0-9]*[A-Za-z-][0-9A-Za-z-]*))*))?(\\+[0-9A-Za-z-]+(\\.[0-9A-Za-z-]+)*)?$"
        },
        "portableAPI": {
          "const": "tplaiter.dev/portable/v1"
        },
        "runtimes": {
          "type": "array",
          "items": {
            "type": "string",
            "pattern": "^[A-Za-z][A-Za-z0-9_.-]{0,127}$"
          },
          "minItems": 1,
          "maxItems": 32,
          "uniqueItems": true
        },
        "layouts": {
          "type": "array",
          "items": {
            "type": "string",
            "pattern": "^[A-Za-z][A-Za-z0-9_.-]{0,127}$"
          },
          "minItems": 1,
          "maxItems": 32,
          "uniqueItems": true
        }
      },
      "required": [
        "minimumCLI",
        "portableAPI",
        "runtimes",
        "layouts"
      ],
      "additionalProperties": false
    },
    "sources": {
      "type": "array",
      "items": {
        "$ref": "#/$defs/sourcePin"
      },
      "minItems": 1,
      "maxItems": 256,
      "uniqueItems": true
    },
    "selfSource": {
      "type": "string",
      "pattern": "^[A-Za-z][A-Za-z0-9_-]{0,127}$"
    },
    "requires": {
      "type": "object",
      "properties": {
        "exports": {
          "type": "array",
          "items": {
            "type": "object",
            "properties": {
              "selector": {
                "type": "string",
                "pattern": "^[A-Za-z][A-Za-z0-9_-]{0,127}\\.(block|skill|approach|package)\\.[A-Za-z][A-Za-z0-9_-]{0,127}$"
              },
              "contractDigest": {
                "type": "string",
                "pattern": "^sha256:[0-9a-f]{64}$"
              },
              "compatibleRange": {
                "type": "string",
                "minLength": 1,
                "maxLength": 1024
              }
            },
            "required": [
              "selector",
              "contractDigest",
              "compatibleRange"
            ],
            "additionalProperties": false
          },
          "minItems": 0,
          "maxItems": 4096,
          "uniqueItems": true
        },
        "capabilities": {
          "type": "array",
          "items": {
            "$ref": "#/$defs/capability"
          },
          "minItems": 0,
          "maxItems": 256,
          "uniqueItems": true
        }
      },
      "required": [
        "exports",
        "capabilities"
      ],
      "additionalProperties": false
    },
    "provides": {
      "type": "array",
      "items": {
        "$ref": "#/$defs/providedCapability"
      },
      "minItems": 0,
      "maxItems": 256,
      "uniqueItems": true
    },
    "conflicts": {
      "type": "array",
      "items": {
        "$ref": "#/$defs/capability"
      },
      "minItems": 0,
      "maxItems": 256,
      "uniqueItems": true
    },
    "replaces": {
      "type": "array",
      "items": {
        "type": "object",
        "properties": {
          "name": {
            "type": "string",
            "pattern": "^[A-Za-z][A-Za-z0-9_.-]{0,127}$"
          },
          "value": {
            "type": "string",
            "pattern": "^[A-Za-z][A-Za-z0-9_.-]{0,127}$"
          },
          "providerRule": {
            "type": "string",
            "pattern": "^[A-Za-z][A-Za-z0-9_.-]{0,127}$"
          },
          "withRule": {
            "type": "string",
            "pattern": "^[A-Za-z][A-Za-z0-9_.-]{0,127}$"
          }
        },
        "required": [
          "name",
          "value",
          "providerRule",
          "withRule"
        ],
        "additionalProperties": false
      },
      "minItems": 0,
      "maxItems": 256,
      "uniqueItems": true
    },
    "bindings": {
      "type": "array",
      "items": {
        "$ref": "#/$defs/binding"
      },
      "minItems": 0,
      "maxItems": 256,
      "uniqueItems": true
    },
    "rules": {
      "type": "array",
      "items": {
        "$ref": "#/$defs/operation"
      },
      "minItems": 1,
      "maxItems": 4096,
      "uniqueItems": true
    },
    "toolConstraints": {
      "type": "array",
      "items": {
        "type": "object",
        "properties": {
          "id": {
            "type": "string",
            "pattern": "^[A-Za-z][A-Za-z0-9_-]{0,127}$"
          },
          "compatibleRange": {
            "type": "string",
            "minLength": 1,
            "maxLength": 1024
          },
          "optionsDigest": {
            "type": "string",
            "pattern": "^sha256:[0-9a-f]{64}$"
          }
        },
        "required": [
          "id",
          "compatibleRange",
          "optionsDigest"
        ],
        "additionalProperties": false
      },
      "minItems": 0,
      "maxItems": 256,
      "uniqueItems": true
    },
    "renames": {
      "type": "array",
      "items": {
        "type": "object",
        "properties": {
          "path": {
            "type": "string",
            "minLength": 1,
            "maxLength": 1024,
            "description": "Semantic validator must enforce canonical relative path, confinement, reserved paths and case-fold uniqueness."
          },
          "oldBlockId": {
            "type": "string",
            "pattern": "^[A-Za-z][A-Za-z0-9_.-]{0,127}$"
          },
          "newBlockId": {
            "type": "string",
            "pattern": "^[A-Za-z][A-Za-z0-9_.-]{0,127}$"
          },
          "expectedBaselineDigest": {
            "type": "string",
            "pattern": "^sha256:[0-9a-f]{64}$"
          },
          "expectedSourceDigest": {
            "type": "string",
            "pattern": "^sha256:[0-9a-f]{64}$"
          }
        },
        "required": [
          "path",
          "oldBlockId",
          "newBlockId",
          "expectedBaselineDigest",
          "expectedSourceDigest"
        ],
        "additionalProperties": false
      },
      "minItems": 0,
      "maxItems": 4096,
      "uniqueItems": true
    }
  },
  "required": [
    "apiVersion",
    "kind",
    "metadata",
    "compatibility",
    "sources",
    "selfSource",
    "requires",
    "provides",
    "conflicts",
    "replaces",
    "bindings",
    "rules",
    "toolConstraints",
    "renames"
  ],
  "additionalProperties": false,
  "$defs": {
    "sourcePin": {
      "oneOf": [
        {
          "type": "object",
          "properties": {
            "alias": {
              "type": "string",
              "pattern": "^[A-Za-z][A-Za-z0-9_-]{0,127}$"
            },
            "providerId": {
              "type": "string",
              "pattern": "^[A-Za-z][A-Za-z0-9_.-]{0,127}$"
            },
            "origin": {
              "type": "string",
              "minLength": 1,
              "maxLength": 1024
            },
            "templatePath": {
              "type": "string",
              "minLength": 1,
              "maxLength": 1024,
              "description": "Semantic validator must enforce canonical relative path, confinement, reserved paths and case-fold uniqueness."
            },
            "requestedRef": {
              "type": "string",
              "minLength": 1,
              "maxLength": 1024
            },
            "treeDigest": {
              "type": "string",
              "pattern": "^sha256:[0-9a-f]{64}$"
            },
            "contentDigest": {
              "type": "string",
              "pattern": "^sha256:[0-9a-f]{64}$"
            },
            "contractDigest": {
              "type": "string",
              "pattern": "^sha256:[0-9a-f]{64}$"
            },
            "evidenceDigest": {
              "type": "string",
              "pattern": "^sha256:[0-9a-f]{64}$"
            },
            "commitAlgorithm": {
              "const": "sha1"
            },
            "commit": {
              "type": "string",
              "pattern": "^[0-9a-f]{40}$"
            }
          },
          "required": [
            "alias",
            "providerId",
            "origin",
            "templatePath",
            "requestedRef",
            "treeDigest",
            "contentDigest",
            "contractDigest",
            "evidenceDigest",
            "commitAlgorithm",
            "commit"
          ],
          "additionalProperties": false
        },
        {
          "type": "object",
          "properties": {
            "alias": {
              "type": "string",
              "pattern": "^[A-Za-z][A-Za-z0-9_-]{0,127}$"
            },
            "providerId": {
              "type": "string",
              "pattern": "^[A-Za-z][A-Za-z0-9_.-]{0,127}$"
            },
            "origin": {
              "type": "string",
              "minLength": 1,
              "maxLength": 1024
            },
            "templatePath": {
              "type": "string",
              "minLength": 1,
              "maxLength": 1024,
              "description": "Semantic validator must enforce canonical relative path, confinement, reserved paths and case-fold uniqueness."
            },
            "requestedRef": {
              "type": "string",
              "minLength": 1,
              "maxLength": 1024
            },
            "treeDigest": {
              "type": "string",
              "pattern": "^sha256:[0-9a-f]{64}$"
            },
            "contentDigest": {
              "type": "string",
              "pattern": "^sha256:[0-9a-f]{64}$"
            },
            "contractDigest": {
              "type": "string",
              "pattern": "^sha256:[0-9a-f]{64}$"
            },
            "evidenceDigest": {
              "type": "string",
              "pattern": "^sha256:[0-9a-f]{64}$"
            },
            "commitAlgorithm": {
              "const": "sha256"
            },
            "commit": {
              "type": "string",
              "pattern": "^[0-9a-f]{64}$"
            }
          },
          "required": [
            "alias",
            "providerId",
            "origin",
            "templatePath",
            "requestedRef",
            "treeDigest",
            "contentDigest",
            "contractDigest",
            "evidenceDigest",
            "commitAlgorithm",
            "commit"
          ],
          "additionalProperties": false
        }
      ]
    },
    "binding": {
      "type": "object",
      "properties": {
        "name": {
          "type": "string",
          "pattern": "^[A-Za-z][A-Za-z0-9_-]{0,127}$"
        },
        "value": {
          "oneOf": [
            {
              "type": "string",
              "maxLength": 32768
            },
            {
              "type": "boolean"
            },
            {
              "type": "integer",
              "minimum": -9007199254740991,
              "maximum": 9007199254740991
            }
          ]
        }
      },
      "required": [
        "name",
        "value"
      ],
      "additionalProperties": false
    },
    "capability": {
      "type": "object",
      "properties": {
        "name": {
          "type": "string",
          "pattern": "^[A-Za-z][A-Za-z0-9_.-]{0,127}$"
        },
        "value": {
          "type": "string",
          "pattern": "^[A-Za-z][A-Za-z0-9_.-]{0,127}$"
        }
      },
      "required": [
        "name",
        "value"
      ],
      "additionalProperties": false
    },
    "providedCapability": {
      "type": "object",
      "properties": {
        "name": {
          "type": "string",
          "pattern": "^[A-Za-z][A-Za-z0-9_.-]{0,127}$"
        },
        "value": {
          "type": "string",
          "pattern": "^[A-Za-z][A-Za-z0-9_.-]{0,127}$"
        },
        "ruleId": {
          "type": "string",
          "pattern": "^[A-Za-z][A-Za-z0-9_.-]{0,127}$"
        }
      },
      "required": [
        "name",
        "value",
        "ruleId"
      ],
      "additionalProperties": false
    },
    "operation": {
      "oneOf": [
        {
          "type": "object",
          "properties": {
            "id": {
              "type": "string",
              "pattern": "^[A-Za-z][A-Za-z0-9_.-]{0,127}$"
            },
            "before": {
              "type": "array",
              "items": {
                "type": "string",
                "pattern": "^[A-Za-z][A-Za-z0-9_.-]{0,127}$"
              },
              "minItems": 0,
              "maxItems": 256,
              "uniqueItems": true
            },
            "after": {
              "type": "array",
              "items": {
                "type": "string",
                "pattern": "^[A-Za-z][A-Za-z0-9_.-]{0,127}$"
              },
              "minItems": 0,
              "maxItems": 256,
              "uniqueItems": true
            },
            "op": {
              "const": "add"
            },
            "export": {
              "type": "string",
              "pattern": "^[A-Za-z][A-Za-z0-9_-]{0,127}\\.(block|skill|approach|package)\\.[A-Za-z][A-Za-z0-9_-]{0,127}$"
            }
          },
          "required": [
            "id",
            "before",
            "after",
            "op",
            "export"
          ],
          "additionalProperties": false
        },
        {
          "type": "object",
          "properties": {
            "id": {
              "type": "string",
              "pattern": "^[A-Za-z][A-Za-z0-9_.-]{0,127}$"
            },
            "before": {
              "type": "array",
              "items": {
                "type": "string",
                "pattern": "^[A-Za-z][A-Za-z0-9_.-]{0,127}$"
              },
              "minItems": 0,
              "maxItems": 256,
              "uniqueItems": true
            },
            "after": {
              "type": "array",
              "items": {
                "type": "string",
                "pattern": "^[A-Za-z][A-Za-z0-9_.-]{0,127}$"
              },
              "minItems": 0,
              "maxItems": 256,
              "uniqueItems": true
            },
            "op": {
              "const": "replace"
            },
            "target": {
              "type": "string",
              "pattern": "^[A-Za-z][A-Za-z0-9_.-]{0,127}$"
            },
            "expectedDigest": {
              "type": "string",
              "pattern": "^sha256:[0-9a-f]{64}$"
            },
            "expectedVersion": {
              "type": "string",
              "pattern": "^(0|[1-9][0-9]*)\\.(0|[1-9][0-9]*)\\.(0|[1-9][0-9]*)(-((0|[1-9][0-9]*|[0-9]*[A-Za-z-][0-9A-Za-z-]*)(\\.(0|[1-9][0-9]*|[0-9]*[A-Za-z-][0-9A-Za-z-]*))*))?(\\+[0-9A-Za-z-]+(\\.[0-9A-Za-z-]+)*)?$"
            },
            "export": {
              "type": "string",
              "pattern": "^[A-Za-z][A-Za-z0-9_-]{0,127}\\.(block|skill|approach|package)\\.[A-Za-z][A-Za-z0-9_-]{0,127}$"
            }
          },
          "required": [
            "id",
            "before",
            "after",
            "op",
            "target",
            "expectedDigest",
            "export"
          ],
          "additionalProperties": false
        },
        {
          "type": "object",
          "properties": {
            "id": {
              "type": "string",
              "pattern": "^[A-Za-z][A-Za-z0-9_.-]{0,127}$"
            },
            "before": {
              "type": "array",
              "items": {
                "type": "string",
                "pattern": "^[A-Za-z][A-Za-z0-9_.-]{0,127}$"
              },
              "minItems": 0,
              "maxItems": 256,
              "uniqueItems": true
            },
            "after": {
              "type": "array",
              "items": {
                "type": "string",
                "pattern": "^[A-Za-z][A-Za-z0-9_.-]{0,127}$"
              },
              "minItems": 0,
              "maxItems": 256,
              "uniqueItems": true
            },
            "op": {
              "const": "remove"
            },
            "target": {
              "type": "string",
              "pattern": "^[A-Za-z][A-Za-z0-9_.-]{0,127}$"
            },
            "expectedDigest": {
              "type": "string",
              "pattern": "^sha256:[0-9a-f]{64}$"
            },
            "expectedVersion": {
              "type": "string",
              "pattern": "^(0|[1-9][0-9]*)\\.(0|[1-9][0-9]*)\\.(0|[1-9][0-9]*)(-((0|[1-9][0-9]*|[0-9]*[A-Za-z-][0-9A-Za-z-]*)(\\.(0|[1-9][0-9]*|[0-9]*[A-Za-z-][0-9A-Za-z-]*))*))?(\\+[0-9A-Za-z-]+(\\.[0-9A-Za-z-]+)*)?$"
            }
          },
          "required": [
            "id",
            "before",
            "after",
            "op",
            "target",
            "expectedDigest"
          ],
          "additionalProperties": false
        }
      ]
    }
  }
}
